{
  "schema_version": "0.1.0-beta",
  "workflow_id": "workflow-0123456789abcdef0123456789abcdef",
  "created_at": "2026-08-19T00:00:00Z",
  "updated_at": "2026-08-19T00:00:00Z",
  "current_stage": "idea_received",
  "supported_method": "conditional_dynamic_association",
  "registry_version": "dynamic-beta-v1",
  "route_action": "route_research_design",
  "request_id": "request-0123456789abcdef",
  "artifact_refs": [],
  "issue_codes": [],
  "checkpoint_id": null,
  "resume_eligible": false,
  "status": "active"
}
